{"run":70,"commit":"582485a","metric":1554,"metrics":{"response_translation_ns":482,"stream_translation_ns":111},"status":"discard","description":"Reuse DEFAULT_FLAGS singleton (no Object.freeze)","timestamp":1776915472478,"segment":1,"confidence":13.676767676767676,"iterationTokens":539,"asi":{"all_runs_run1":[1568,1578,1968,1613,1589,1800,1554,1844,1584,1568],"all_runs_run2":[1622,1587,1728,1602,1713,1699,1952,1750,1673,1622],"best":1554,"hypothesis":"Reuse DEFAULT_FLAGS singleton when no sanitize/reorder options - skip object alloc per call","median_combined":1641,"rollback_reason":"Marginal at best (1554 vs 1561 baseline). Within noise. Per-call object alloc not significant."}}
{"run":71,"commit":"582485a","metric":311,"metrics":{"response_translation_ns":482,"stream_translation_ns":111},"status":"discard","description":"[CHEAT-REVERTED] WeakMap cache messages translation result","timestamp":1776915606484,"segment":1,"confidence":13.676767676767676,"iterationTokens":7390,"asi":{"all_runs":[327,312,321,311,328,325,322,322,318,327],"best":311,"hypothesis":"WeakMap cache translateAnthropicMessagesToOpenAI on messages array reference","median":322,"rollback_reason":"BENCHMARK CHEATING: bench reuses same payload (same messages array reference) so cache always hits after warmup. Production traffic creates fresh messages arrays per request -> cache never hits -> zero real benefit. Violates 'no benchmark-specific optimizations' rule.","decision_note":"5x apparent gain is fake; reverting per autoresearch.md anti-cheat rule"}}
{"run":72,"commit":"582485a","metric":1593,"metrics":{"response_translation_ns":482,"stream_translation_ns":111},"status":"discard","description":"Pre-allocate result array via new Array(N), then shrink length to 0","timestamp":1776915656105,"segment":1,"confidence":12.834123222748815,"iterationTokens":5311,"asi":{"all_runs":[1629,1804,1654,1643,1626,1642,1636,1593,1609,1629],"best":1593,"hypothesis":"new Array(N).length=0 to reserve push capacity","median":1636,"rollback_reason":"Worse than baseline. The length-shrink trick may cause hidden class transition, or push() into prefilled holes is slower than into empty array"}}
{"run":73,"commit":"582485a","metric":1563,"metrics":{"response_translation_ns":482,"stream_translation_ns":111},"status":"discard","description":"Inline optional fields directly in translateToOpenAI result literal","timestamp":1776915726263,"segment":1,"confidence":12.089285714285714,"iterationTokens":511,"asi":{"all_runs_run1":[1706,1567,1592,1610,1754,1602,1567,1608,1563,1706],"all_runs_run2":[1571,1662,1739,1649,1722,1600,1627,1858,1579,1571],"best":1563,"hypothesis":"Inline optional field expressions into result literal (skip dead `=== undefined ? undefined : x` no-ops)","median_combined":1610,"rollback_reason":"Wash — best 1563 vs baseline 1561, within high variance band. The intermediate `const X = ...; X` pattern was already JIT-eliminated."}}
{"run":74,"commit":"582485a","metric":1594,"metrics":{"response_translation_ns":482,"stream_translation_ns":111},"status":"discard","description":"Cache system Message by content string","timestamp":1776915831619,"segment":1,"confidence":11.929515418502202,"iterationTokens":1696,"asi":{"all_runs":[1594,1689,1631,1718,1727,1653,1824,1600,1608,1594],"best":1594,"hypothesis":"Cache system Message object by content string (Map<string, Message>)","median":1671,"rollback_reason":"Worse than baseline. Object literal alloc is already very fast; Map.get overhead exceeds savings. Also potential hidden-class issues from sharing object refs in result array."}}
{"run":75,"commit":"582485a","metric":1559,"metrics":{"response_translation_ns":482,"stream_translation_ns":111},"status":"checks_failed","description":"Inline translateAnthropicToolChoiceToOpenAI","timestamp":1776915961025,"segment":1,"confidence":11.474576271186441,"iterationTokens":3272,"asi":{"all_runs":[1559,1635,1577,1632,1750,1583,1574,1616,1579,1559],"best":1559,"hypothesis":"Inline translateAnthropicToolChoiceToOpenAI in translateToOpenAI","median":1599,"rollback_reason":"Coverage protocols/ 99.37 -> 96.16 (-3.21pp, below floor). translateAnthropicToolChoiceToOpenAI becomes dead code. Also no real perf gain (1559 vs 1561 baseline)."}}
{"run":76,"commit":"582485a","metric":1569,"metrics":{"response_translation_ns":482,"stream_translation_ns":111},"status":"discard","description":"Inline assistant string fast path in outer loop","timestamp":1776916013021,"segment":1,"confidence":11.053061224489795,"iterationTokens":7385,"asi":{"all_runs":[1695,1867,1679,1647,1616,1569,1634,1630,1661,1695],"best":1569,"hypothesis":"Inline assistant string-content fast path in main loop","median":1654,"rollback_reason":"No improvement (1569 vs 1561 baseline). The function call to appendAssistantMessage is already JIT-inlined for the string fast-path."}}
{"run":77,"commit":"582485a","metric":1626,"metrics":{"response_translation_ns":482,"stream_translation_ns":111},"status":"discard","description":"Lazy-alloc textParts in mapContent","timestamp":1776916061309,"segment":1,"confidence":10.661417322834646,"iterationTokens":3772,"asi":{"all_runs":[1626,1628,2517,1727,1667,1824,1658,1673,1644,1626],"best":1626,"hypothesis":"Lazy-allocate textParts in mapContent (skip empty array alloc when content has no text/thinking)","median":1665,"rollback_reason":"Worse than baseline. Null-check overhead per block exceeds savings of avoiding 1 empty array alloc"}}
{"run":78,"commit":"d33a0a8","metric":1590,"metrics":{"response_translation_ns":463,"stream_translation_ns":87},"status":"keep","description":"Hoist STOP_REASON_MAP to module level (skip per-call alloc)","timestamp":1776916123676,"segment":1,"confidence":9.992619926199263,"iterationTokens":2310,"asi":{"all_request":[1904,1791,1618,1622,1626,1656,1670,1709,1590,1609],"all_response":[595,537,486,463,470,501,502,536,833,951],"all_stream":[116,97,96,89,91,95,100,110,114,87],"best_request":1590,"best_response":463,"best_stream":87,"hypothesis":"Hoist STOP_REASON_MAP literal out of mapOpenAIStopReasonToAnthropic - was being allocated on every call"}}
{"run":79,"commit":"d33a0a8","metric":1500,"metrics":{"response_translation_ns":463,"stream_translation_ns":87},"status":"checks_failed","description":"Inline user string fast path in outer loop","timestamp":1776916244995,"segment":1,"confidence":9.402777777777779,"iterationTokens":2624,"asi":{"all_runs":[1552,1663,1578,1500,1522,1554,1531,1556,1599,1552],"best":1500,"hypothesis":"Inline user string-content fast path in outer loop","median":1554,"next_action_hint":"Retry with the dead else branch removed from appendUserMessage","perf_gain_real":"1500/1554 vs 1561/1613 baseline = 4-5% real improvement","rollback_reason":"Coverage protocols/ -0.85pp because the appendUserMessage's else (string fallback) branch is now dead code. Need to clean up or route fallback through it."}}
{"run":80,"commit":"d33a0a8","metric":1540,"metrics":{"response_translation_ns":463,"stream_translation_ns":87},"status":"discard","description":"Inline user string fast path in outer loop, prune dead else branch","timestamp":1776916315930,"segment":1,"confidence":9.026666666666667,"iterationTokens":510,"asi":{"all_runs_run1":[1540,2696,1822,2143,1865,1886,1621,1703,1917,1540],"all_runs_run2":[1604,1558,1642,1934,1612,1661,1546,1636,1566,1604],"best":1540,"hypothesis":"Inline user string fast path + remove dead else branch in appendUserMessage","median_run2":1612,"rollback_reason":"Wash with high variance. Best 1540 vs 1548 baseline = within noise. Adds structural complexity (cast, callsite branching) without clear win."}}
{"run":81,"commit":"d33a0a8","metric":1574,"metrics":{"response_translation_ns":463,"stream_translation_ns":87},"status":"discard","description":"Per-tool Map cache keyed by name + ref verification","timestamp":1776916378119,"segment":1,"confidence":8.679487179487179,"iterationTokens":4887,"asi":{"all_runs":[1634,1574,1716,1919,1803,1606,1654,1575,1616,1634],"best":1574,"hypothesis":"Per-tool Map cache keyed by tool.name with reference verification","median":1634,"rollback_reason":"Within noise (1574 vs 1561 baseline). The cache requires source ref equality which is bench-friendly but production-rare. Cleared as it doesn't legit-help."}}
{"run":82,"commit":"d33a0a8","metric":1547,"metrics":{"response_translation_ns":463,"stream_translation_ns":87},"status":"checks_failed","description":"Fast-path tool_choice type='auto' inline at callsite","timestamp":1776916503810,"segment":1,"confidence":8.43613707165109,"iterationTokens":4887,"asi":{"all_runs":[1627,1558,1616,1587,1590,1690,1604,1733,1547,1627],"best":1547,"hypothesis":"Fast-path for tool_choice type==='auto' to skip function call + switch","median":1610,"next_action":"Remove dead 'auto' case from translateAnthropicToolChoiceToOpenAI to recover coverage","rollback_reason":"Coverage protocols/ -0.28pp because the 'auto' switch case in translateAnthropicToolChoiceToOpenAI is now unreachable from translateToOpenAI tests"}}
{"run":83,"commit":"d33a0a8","metric":1564,"metrics":{"response_translation_ns":463,"stream_translation_ns":87},"status":"discard","description":"Fast-path tool_choice 'auto' + drop dead case","timestamp":1776916552683,"segment":1,"confidence":8.306748466257668,"iterationTokens":513,"asi":{"all_runs_combined_best":1564,"hypothesis":"Fast-path 'auto' inline + remove dead 'auto' case from function (default null preserved)","median_combined":1620,"rollback_reason":"Within noise (best 1564 vs 1561 baseline). Function call overhead in this path is too small to make a measurable difference."}}
{"run":84,"commit":"d33a0a8","metric":1537,"metrics":{"response_translation_ns":463,"stream_translation_ns":87},"status":"discard","description":"Single-entry hot cache before Map for translateModelName","timestamp":1776916681444,"segment":1,"confidence":8.358024691358025,"iterationTokens":539,"asi":{"all_run1":[1765,1706,1537,1779,1550,1690,1578,1554,1561,1765],"all_run2":[1568,1725,1617,1606,1592,1590,1583,1596,1761,1568],"all_run3":[1584,1675,1623,1598,1650,1807,1775,1638,1641,1584],"best_combined":1537,"hypothesis":"Hot-cache (single-entry) for translateModelName before Map lookup","median_combined":1614,"rollback_reason":"Marginal best (1537 vs 1561) but median similar (~1614 vs ~1613). Within noise across 30 runs. Adds 3 module-level mutable vars for structural complexity not justified by gain."}}
{"run":85,"commit":"d33a0a8","metric":1692,"metrics":{"response_translation_ns":463,"stream_translation_ns":87},"status":"discard","description":"Replace kept counter with 3-array length check","timestamp":1776916760715,"segment":1,"confidence":8.409937888198758,"iterationTokens":8896,"asi":{"all_runs":[1743,1890,1692,1699,1692,1785,1798,1763,1881,1743],"best":1692,"hypothesis":"Skip kept counter; check three array lengths instead","median":1763,"rollback_reason":"Significantly worse (1692 vs 1561 baseline). The 3-way array.length comparison is more expensive than the kept++ counter increment that JIT folds away."}}
{"run":86,"commit":"d33a0a8","metric":1587,"metrics":{"response_translation_ns":463,"stream_translation_ns":87},"status":"discard","description":"Drop `in` guard before delete in stripBlockMetadata/stripToolUseFields","timestamp":1776916797268,"segment":1,"confidence":8.43613707165109,"iterationTokens":2870,"asi":{"all_runs":[1682,1630,1658,1679,1642,1587,1596,1618,1625,1682],"best":1587,"hypothesis":"Always delete (no `in` guard) since delete-of-missing is a no-op","median":1636,"rollback_reason":"Worse (1587 vs 1561 baseline). `delete` triggers hidden-class transition checks even when the property is missing, while `in` is a fast hidden-class slot lookup."}}
{"run":87,"commit":"d33a0a8","metric":1561,"metrics":{"response_translation_ns":463,"stream_translation_ns":87},"status":"discard","description":"NO_FLAGS singleton at callsite","timestamp":1776916837972,"segment":1,"confidence":8.05952380952381,"iterationTokens":3313,"asi":{"all_runs":[1628,1663,1604,1616,1596,1768,1561,1645,1659,1628],"best":1561,"hypothesis":"NO_FLAGS singleton + ternary at callsite when both flags absent","median":1628,"rollback_reason":"Equal best, slightly worse median. Same finding as runs 53/70: per-call object alloc cost negligible vs. ternary branch overhead."}}
{"run":88,"commit":"d33a0a8","metric":1583,"metrics":{"response_translation_ns":463,"stream_translation_ns":87},"status":"discard","description":"Pack MessageTranslateFlags as numeric bitfield","timestamp":1776916918245,"segment":1,"confidence":7.781609195402299,"iterationTokens":6548,"asi":{"all_runs":[1629,1583,1591,1599,1736,1686,1639,1714,1647,1629],"best":1583,"hypothesis":"Pack flags as numeric bitfield: zero-check is single load+test","median":1639,"rollback_reason":"Slightly worse than baseline (1583 vs 1561). Bitwise ops aren't cheaper than property reads on a small pre-allocated object that JIT specializes."}}
{"run":89,"commit":"d33a0a8","metric":1571,"metrics":{"response_translation_ns":463,"stream_translation_ns":87},"status":"discard","description":"Inline stripBlockMetadata at hot call sites","timestamp":1776917050817,"segment":1,"confidence":7.693181818181818,"iterationTokens":509,"asi":{"all_run1":[1645,1650,1614,1572,1637,1636,1571,1622,1623,1645],"all_run2":[1913,1611,1645,1605,1825,2145,1702,1575,1819,1913],"best_combined":1571,"hypothesis":"Inline stripBlockMetadata at hot call sites in append* loops","median_combined":1647,"rollback_reason":"No gain (1571 vs 1561) and slightly worse median. Bun JIT already inlines small functions; manual inlining bloats loop body and hurts code locality"}}
{"run":90,"commit":"d33a0a8","metric":1581,"metrics":{"response_translation_ns":463,"stream_translation_ns":87},"status":"discard","description":"charCodeAt-based role dispatch","timestamp":1776917136016,"segment":1,"confidence":7.671388101983003,"iterationTokens":3934,"asi":{"all_runs":[1612,1661,1614,1689,1672,1581,1649,1646,1705,1612],"best":1581,"hypothesis":"Replace string equality with charCodeAt(0) === 97 for role dispatch","median":1648,"rollback_reason":"Worse than baseline. JSC's interned-string ===compare is fast (pointer compare); charCodeAt requires a load from string memory which is slower. Type cast also adds friction."}}
{"run":91,"commit":"d33a0a8","metric":1578,"metrics":{"response_translation_ns":463,"stream_translation_ns":87},"status":"discard","description":"Drop no-op === undefined ternaries; pre-load metadata","timestamp":1776917182095,"segment":1,"confidence":7.7371428571428575,"iterationTokens":497,"asi":{"all_run1":[1757,2097,1591,1657,1607,1585,1639,1593,1578,1757],"all_run2":[1651,1631,1592,1606,1745,1599,1774,1734,1623,1651],"best_combined":1578,"hypothesis":"Cleanup: drop redundant === undefined ternaries; fold metadata access","median_combined":1626,"rollback_reason":"Wash (1578 vs 1561 baseline). The redundant ternaries were already JIT-eliminated."}}
{"run":92,"commit":"d33a0a8","metric":1558,"metrics":{"response_translation_ns":463,"stream_translation_ns":87},"status":"checks_failed","description":"Object.create(null) cache for translateModelName","timestamp":1776917221864,"segment":1,"confidence":7.826589595375722,"iterationTokens":3388,"asi":{"all_runs":[1647,1631,1686,1571,1721,1558,1564,1575,1602,1647],"best":1558,"hypothesis":"Replace Map with prototype-less Object for MODEL_NAME_CACHE","median":1617,"rollback_reason":"Coverage protocols/ -0.28pp because the manual eviction branch (size >= 64) is never tested. Also no perf gain (1558 vs 1561). Bun's Map is well-optimized."}}
{"run":93,"commit":"d33a0a8","metric":1632,"metrics":{"response_translation_ns":463,"stream_translation_ns":87},"status":"discard","description":"for-of loop for main message dispatch","timestamp":1776917275765,"segment":1,"confidence":7.918128654970761,"iterationTokens":6822,"asi":{"all_runs":[1645,1636,1635,1661,1671,1675,1636,1741,1632,1645],"best":1632,"hypothesis":"Use for-of for main message loop","median":1645,"rollback_reason":"Worse than baseline. for-of has iterator protocol overhead even when JIT-specialized for arrays"}}
{"run":94,"commit":"d33a0a8","metric":1611,"metrics":{"response_translation_ns":463,"stream_translation_ns":87},"status":"discard","description":"Hoist metadata, replace ?. with ternary","timestamp":1776917302007,"segment":1,"confidence":8.181268882175226,"iterationTokens":1794,"asi":{"all_runs":[2617,1638,1707,1618,1644,1611,1614,1778,1651,2617],"best":1611,"hypothesis":"Hoist payload.metadata then truthy-check + property access (skip optional chain)","median":1644,"rollback_reason":"Worse than baseline. JIT already optimizes optional chaining for object/null."}}
{"run":95,"commit":"d33a0a8","metric":1586,"metrics":{"response_translation_ns":463,"stream_translation_ns":87},"status":"discard","description":"Baseline validation (no code change)","timestamp":1776917335785,"segment":1,"confidence":8.25609756097561,"iterationTokens":2117,"asi":{"all_runs":[1633,1694,2342,1632,1606,1644,1758,1796,1586,1633],"best":1586,"hypothesis":"Validation pass on HEAD to confirm baseline holds after 81 experiments","median":1638,"rollback_reason":"No code change - just baseline confirmation. Session saturated at ~1561 best.","session_summary":"81 experiments after run 67 (translateModelName cache); only run 78 (STOP_REASON_MAP hoist) was kept. 79 attempted optimizations were wash/worse/coverage-fail. Variance ~15% dominates further sub-percent gains."}}
{"run":96,"commit":"d33a0a8","metric":1547,"metrics":{"response_translation_ns":463,"stream_translation_ns":87},"status":"discard","description":"Inline string-system fast path","timestamp":1776917431997,"segment":1,"confidence":8.181268882175226,"iterationTokens":529,"asi":{"all_run1":[1607,1588,1717,1581,1624,1598,1682,1583,1553,1607],"all_run2":[1662,1600,1677,1655,1695,1594,1564,1604,1643,1662],"all_run3":[1603,1632,1771,2067,1722,1607,1547,1627,1755,1603],"best_combined":1547,"hypothesis":"Inline string-system fast path; appendSystemPrompt only handles array case","median_combined":1625,"rollback_reason":"Marginal best (1547 vs 1561), wash median (~1625 vs ~1613). Adds a branch at callsite for ~free function call (already JIT-inlined for string)."}}
