{"type":"config","name":"Hot Path Performance Optimization","metricName":"total_µs","metricUnit":"µs","bestDirection":"lower"}
{"run":1,"commit":"42650e0","metric":3862,"metrics":{"request_translation_µs":3052,"response_translation_µs":561,"stream_translation_µs":249},"status":"keep","description":"Baseline: add METRIC output to perf benchmarks","timestamp":1776389112759,"segment":0,"confidence":null,"iterationTokens":3533,"asi":{"hypothesis":"Establish baseline metrics for hot path performance","request_translation_µs":3052,"response_translation_µs":561,"stream_translation_µs":249}}
{"run":2,"commit":"11f594a","metric":3871,"metrics":{"request_translation_µs":3031,"response_translation_µs":573,"stream_translation_µs":267},"status":"keep","description":"Logger: skip event creation when level check fails","timestamp":1776389200841,"segment":0,"confidence":null,"iterationTokens":382,"asi":{"hypothesis":"Skip log event creation when level check fails in logger.debug/info/warn/error","rollback_reason":"No measurable improvement in benchmarks","observation":"Benchmark variance ~5% (3846-4029µs). Logger optimization is valid but not measurable in current benchmarks which don't trigger debug logs."}}
{"run":3,"commit":"7a5cd60","metric":3688,"metrics":{"request_translation_µs":2837,"response_translation_µs":581,"stream_translation_µs":270},"status":"keep","description":"Single-pass categorization in handleAssistantMessage","timestamp":1776389261933,"segment":0,"confidence":19.333333333333332,"iterationTokens":381,"asi":{"hypothesis":"Single-pass categorization in handleAssistantMessage: replace 3 separate filter() calls with one for-switch loop","observation":"Consistent improvement: 3663-3811µs vs 3862µs baseline (5-6% improvement)","request_translation_improvement":"~200µs faster"}}
{"run":4,"commit":"b13cdff","metric":3668,"metrics":{"request_translation_µs":2814,"response_translation_µs":593,"stream_translation_µs":261},"status":"keep","description":"Single-pass categorization in handleUserMessage","timestamp":1776389306830,"segment":0,"confidence":2.120218579234973,"iterationTokens":379,"asi":{"hypothesis":"Single-pass categorization in handleUserMessage: replace 2 filter() calls with one for loop","observation":"Results 3552-3784µs, marginal improvement over 3688µs","cumulative_improvement":"~8% from baseline"}}
{"run":5,"commit":"1c157e4","metric":3675,"metrics":{"request_translation_µs":2774,"response_translation_µs":607,"stream_translation_µs":294},"status":"keep","description":"Single-pass mapContent: detect image and collect text together","timestamp":1776389357154,"segment":0,"confidence":9.7,"iterationTokens":383,"asi":{"observation":"Results 3550-3821µs, within variance of previous 3668µs","hypothesis":"Single-pass in mapContent: replace .some()+.filter()+.map()+.join() with one for-switch loop for non-image path"}}
{"run":6,"commit":"1c157e4","metric":3680,"metrics":{"request_translation_µs":2830,"response_translation_µs":584,"stream_translation_µs":297},"status":"discard","description":"SSE parseSSELine charCodeAt optimization (reverted - no gain)","timestamp":1776389417158,"segment":0,"confidence":15.52,"iterationTokens":383,"asi":{"hypothesis":"Replace startsWith with charCodeAt in parseSSELine for faster prefix detection","next_action_hint":"Focus on other hot paths - SSE parser is already fast enough","observation":"No measurable improvement (3664-3696µs vs 3675µs baseline). Code complexity increased significantly.","rollback_reason":"No performance gain, reduced readability"}}
{"run":7,"commit":"ba27c0a","metric":3477,"metrics":{"request_translation_µs":2680,"response_translation_µs":578,"stream_translation_µs":219},"status":"keep","description":"Optimize isToolBlockOpen: for-in loop instead of Object.values().some()","timestamp":1776389458420,"segment":0,"confidence":32.083333333333336,"iterationTokens":380,"asi":{"cumulative_improvement":"~10% from baseline (3862 -> 3477)","hypothesis":"Replace Object.values().some() with for-in loop in isToolBlockOpen to avoid array allocation","observation":"stream_translation improved ~20% (270µs -> 215µs)","stream_translation_improvement":"20%"}}
{"run":8,"commit":"6fc4117","metric":3507,"metrics":{"request_translation_µs":2742,"response_translation_µs":543,"stream_translation_µs":222},"status":"keep","description":"Avoid array allocation in tool sanitization","timestamp":1776389518316,"segment":0,"confidence":4.254143646408839,"iterationTokens":383,"asi":{"cumulative_improvement":"~12% from baseline","hypothesis":"Avoid array allocation in sanitizeToolDefinitions by using direct single-tool function","observation":"Results 3393-3712µs, marginal improvement"}}
{"run":9,"commit":"6fc4117","metric":3897,"metrics":{"request_translation_µs":2780,"response_translation_µs":514,"stream_translation_µs":633},"status":"discard","description":"Inline translateToAnthropic (reverted - performance regression)","timestamp":1776389687775,"segment":0,"confidence":2.2254335260115607,"iterationTokens":381,"asi":{"hypothesis":"Inline translateToAnthropic content extraction to avoid intermediate arrays","next_action_hint":"Keep helper functions - inlining added complexity without benefit","observation":"Performance degraded (3882-4004µs vs 3507µs baseline). Type handling complexity may have caused slowdown.","rollback_reason":"Performance regression, no improvement"}}
{"run":10,"commit":"ca5c43f","metric":3472,"metrics":{"request_translation_µs":2682,"response_translation_µs":582,"stream_translation_µs":208},"status":"keep","description":"filterContentBlocks fast path: avoid array allocation when no filtering needed","timestamp":1776389740758,"segment":0,"confidence":2.1971830985915495,"iterationTokens":381,"asi":{"hypothesis":"Fast path in filterContentBlocks: avoid array allocation when no filtering needed","observation":"Results 3472-3716µs, within variance. Optimization valid for real-world case where most content blocks are supported."}}
{"run":11,"commit":"6caed05","metric":3537,"metrics":{"request_translation_µs":2740,"response_translation_µs":581,"stream_translation_µs":213},"status":"keep","description":"Pre-compile model name translation regexes","timestamp":1776389822893,"segment":0,"confidence":2.3214285714285716,"iterationTokens":383,"asi":{"hypothesis":"Pre-compile model name translation regexes to avoid regex compilation on each call","observation":"Results 3537-3647µs, within variance. Good code practice but marginal benchmark impact."}}
{"run":12,"commit":"77d1638","metric":3463,"metrics":{"request_translation_µs":2680,"response_translation_µs":571,"stream_translation_µs":212},"status":"keep","description":"Final validation: ~10% improvement confirmed","timestamp":1776389851980,"segment":0,"confidence":2.247887323943662,"iterationTokens":1078,"asi":{"hypothesis":"Final validation: 5 consecutive runs to confirm stability","observation":"Results stable at 3420-3536µs, ~10% improvement from baseline 3862µs","session_summary":"Optimized 8 hot path functions with single-pass loops, avoiding array allocations, and pre-compiled regexes"}}
{"run":13,"commit":"1c27893","metric":3839,"metrics":{"request_translation_µs":3071,"response_translation_µs":554,"stream_translation_µs":214},"status":"keep","description":"Fix regressions: logger bus, text/thinking order, filterContentBlocks immutability","timestamp":1776390325411,"segment":0,"confidence":2.375,"iterationTokens":11197,"asi":{"fixes":["Logger: remove early return that blocked events from central bus","handleAssistantMessage: preserve text-before-thinking order semantics","filterContentBlocks: always return new array to maintain immutability contract"],"hypothesis":"Fix three semantic/contract regressions introduced by performance optimizations","observation":"Performance slightly worse (3839µs vs 3463µs) but correctness restored"}}
{"type":"config","name":"Hot Path Performance Optimization (per-op latency)","metricName":"request_translation_ns","metricUnit":"ns","bestDirection":"lower"}
{"run":14,"commit":"18b9154","metric":2915,"metrics":{"response_translation_ns":680,"stream_translation_ns":105},"status":"keep","description":"New baseline with per-op latency metrics (ns). Includes all prior optimizations.","timestamp":1776391889645,"segment":1,"confidence":null,"iterationTokens":139,"asi":{"hypothesis":"Establish new baseline with correct metric naming (per-op latency in ns)","notes":"Prior session achieved ~10% improvement but used total_µs which was misleading"}}
{"run":15,"commit":"848cb68","metric":2775,"metrics":{"response_translation_ns":579,"stream_translation_ns":152},"status":"keep","description":"Eliminate object/array double-spreads in translateToOpenAI &amp; handleAssistantMessage","timestamp":1776909874950,"segment":1,"confidence":null,"iterationTokens":6355,"asi":{"hypothesis":"Build result object directly instead of {...base, ...optional}; replace double [...textParts, ...thinkingParts] with single concat","best_of_5":2775,"all_runs":[3620,3752,3051,3095,2775]}}
{"run":16,"commit":"9cbc448","metric":2752,"metrics":{"response_translation_ns":653,"stream_translation_ns":127},"status":"keep","description":"Single-pass extractToolUseIds; avoid systemMessages spread","timestamp":1776909919829,"segment":1,"confidence":7.086956521739131,"iterationTokens":4431,"asi":{"hypothesis":"Single-pass tool_use ID extraction without filter().map() intermediate arrays; avoid leading [...systemMessages, ...result] spread","all_runs":[2963,2803,2741,2810,2752],"best_of_5":2741,"median":2803}}
{"run":17,"commit":"inline-","metric":2905,"metrics":{"response_translation_ns":770,"stream_translation_ns":166},"status":"discard","description":"Inline filterContentBlocks into categorization loops","timestamp":1776909989393,"segment":1,"confidence":2.3285714285714287,"iterationTokens":7104,"asi":{"all_runs":[4023,3354,2957,3668,2905],"best_of_5":2905,"hypothesis":"Inline filterContentBlocks into handleAssistantMessage/handleUserMessage categorization loop","rollback_reason":"No measurable improvement; runtime variance dominates","next_action_hint":"Try response translation optimizations or skip filterContentBlocks fast path entirely"}}
{"run":18,"commit":"single-","metric":2809,"metrics":{"response_translation_ns":632,"stream_translation_ns":175},"status":"discard","description":"Single-pass translateToAnthropic, drop helper functions","timestamp":1776910108970,"segment":1,"confidence":2.8596491228070176,"iterationTokens":3948,"asi":{"all_runs_request":[3090,2813,2809,2852,3356],"all_runs_response":[632,610,799,607,893],"best_request":2809,"hypothesis":"Single-pass translateToAnthropic: build text+tool_use blocks directly in choice loop, avoid getAnthropicTextBlocks/getAnthropicToolUseBlocks helper allocations and final spread","rollback_reason":"No measurable improvement; response_translation seems slightly worse. Helpers were already cheap."}}
{"run":19,"commit":"filter-","metric":2810,"metrics":{"response_translation_ns":643,"stream_translation_ns":166},"status":"discard","description":"filterContentBlocks fast path returns input array when nothing filtered","timestamp":1776910158637,"segment":1,"confidence":3.5434782608695654,"iterationTokens":5245,"asi":{"all_runs":[2942,3328,2968,2810,3121],"best_request":2810,"hypothesis":"Fast path in filterContentBlocks: return original array when no unsupported types found","rollback_reason":"No measurable improvement; filterContentBlocks not the bottleneck"}}
{"run":20,"commit":"f0bf090","metric":2607,"metrics":{"response_translation_ns":676,"stream_translation_ns":148},"status":"keep","description":"appendUserMessage/appendAssistantMessage push directly to shared result; assistant returns ids inline","timestamp":1776910278909,"segment":1,"confidence":5.4035087719298245,"iterationTokens":775,"asi":{"all_runs":[2766,2607,2718,2833,2648,2723,2723],"best_request":2607,"median":2723,"hypothesis":"Refactor handleAssistantMessage/handleUserMessage to push directly into shared `result` array (appendXxx pattern), eliminating per-message intermediate array + spread + duplicate iteration in extractToolUseIdsFast (IDs returned directly from append loop)"}}
{"run":21,"commit":"b2419ad","metric":2513,"metrics":{"response_translation_ns":679,"stream_translation_ns":127},"status":"keep","description":"appendSystemPrompt pushes into shared result; remove systemMessages spread","timestamp":1776910324989,"segment":1,"confidence":5.254901960784314,"iterationTokens":3578,"asi":{"all_runs":[2601,2713,2565,2580,2650,2513,2516],"best_request":2513,"hypothesis":"Inline system prompt push directly into shared result via appendSystemPrompt; eliminate systemMessages array allocation + push spread","median":2580}}
{"run":22,"commit":"map-con","metric":2523,"metrics":{"response_translation_ns":703,"stream_translation_ns":125},"status":"discard","description":"Single-pass mapContent that switches to contentParts on image","timestamp":1776910388043,"segment":1,"confidence":3.0923076923076924,"iterationTokens":819,"asi":{"all_runs_request":[2789,2962,2634,2557,2693,2721,2523],"best_request":2523,"hypothesis":"mapContent: collapse two passes into one (build ContentParts on-the-fly when image detected)","median":2693,"rollback_reason":"Median slightly worse; transition cost from textParts to contentParts hurts non-image case"}}
{"run":23,"commit":"fuse-as","metric":2522,"metrics":{"response_translation_ns":736,"stream_translation_ns":166},"status":"discard","description":"Fuse filterContentBlocks into appendAssistantMessage categorization loop","timestamp":1776910443340,"segment":1,"confidence":2.744027303754266,"iterationTokens":5093,"asi":{"all_runs":[2656,2522,2832,2549,2754,2720,2673],"best_request":2522,"hypothesis":"Fuse filterContentBlocks with categorization in appendAssistantMessage","median":2673,"rollback_reason":"Median slightly worse than prior 2580; no measurable benefit"}}
{"run":24,"commit":"18f49ea","metric":2380,"metrics":{"response_translation_ns":719,"stream_translation_ns":135},"status":"keep","description":"appendUserMessage fast path: direct push when no tool-result flags","timestamp":1776910525277,"segment":1,"confidence":3.496732026143791,"iterationTokens":806,"asi":{"all_runs":[2454,2391,2560,2380,2509,2457,2445],"best_request":2380,"hypothesis":"Fast path in appendUserMessage when no tool-result sanitization/reordering flags active: push tool messages directly into result, lazily allocate otherBlocks","median":2457}}
{"run":25,"commit":"ef758eb","metric":2355,"metrics":{"response_translation_ns":700,"stream_translation_ns":130},"status":"keep","description":"Fuse filterContentBlocks into appendUserMessage fast path","timestamp":1776910596169,"segment":1,"confidence":3.56687898089172,"iterationTokens":1108,"asi":{"all_runs_request":[2355,2685,2493,2376,2653,2368,2357,2532,2361,2512],"best_request":2355,"hypothesis":"Inline filterContentBlocks into appendUserMessage fast path: avoid one array allocation + iteration per user message","median":2435}}
{"run":26,"commit":"3758977","metric":2273,"metrics":{"response_translation_ns":700,"stream_translation_ns":130},"status":"keep","description":"Fuse filterContentBlocks into appendAssistantMessage categorization loop","timestamp":1776910634719,"segment":1,"confidence":3.1782178217821784,"iterationTokens":3320,"asi":{"all_runs_request":[2608,2429,2586,2315,2286,2385,2357,2273,2318,2371],"best_request":2273,"hypothesis":"Fuse filterContentBlocks with categorization in appendAssistantMessage: build filteredContent + textParts + thinkingParts + toolUseBlocks in one pass over message.content","median":2371}}
{"run":27,"commit":"d0fa172","metric":2241,"metrics":{"response_translation_ns":700,"stream_translation_ns":130},"status":"keep","description":"Indexed for-loop in append* hot loops; cache content array","timestamp":1776910672647,"segment":1,"confidence":3.2095238095238097,"iterationTokens":2895,"asi":{"all_runs_request":[2261,2324,2468,2243,2241,2356,2267,3323,2265,2962],"best_request":2241,"hypothesis":"Use indexed for-loop instead of for-of in append* hot loops; cache message.content in local var","median":2295}}
{"run":28,"commit":"963b738","metric":2127,"metrics":{"response_translation_ns":700,"stream_translation_ns":130},"status":"keep","description":"Indexed for-loop in translateAnthropicMessagesToOpenAI outer loop","timestamp":1776910702556,"segment":1,"confidence":3.152,"iterationTokens":2563,"asi":{"all_runs_request":[2263,2509,2229,2340,2378,2210,2127,2497,2282,2139],"best_request":2127,"hypothesis":"Indexed for-loop in outer messages iteration","median":2272}}
{"run":29,"commit":"bd28deb","metric":2085,"metrics":{"response_translation_ns":700,"stream_translation_ns":130},"status":"keep","description":"Indexed for-loops in mapContent + slow path","timestamp":1776910752087,"segment":1,"confidence":3.306772908366534,"iterationTokens":887,"asi":{"all_runs_request_run1":[2133,2217,2161,2160,2730,2226,2585,2406,6435,2619],"all_runs_request_run2":[2420,2176,2206,2379,2242,2244,2139,2162,2248,2085],"best_request":2085,"hypothesis":"Indexed for-loop in mapContent (both passes), appendUserMessage slow path categorization, and toolResultBlocks output loop","median_run2":2224}}
{"run":30,"commit":"f33539f","metric":2130,"metrics":{"response_translation_ns":580,"stream_translation_ns":121},"status":"keep","description":"translateToAnthropic: append* pattern, no spreads/intermediate arrays, indexed loops","timestamp":1776910829474,"segment":1,"confidence":3.280632411067194,"iterationTokens":7593,"asi":{"all_runs_request":[2244,2281,2130,2184,2280,2195,2166,2224,2155,2315],"all_runs_response":[542,604,610,523,610,593,568,539,610,580],"best_request":2130,"best_response":523,"hypothesis":"Refactor translateToAnthropic to use append* helpers writing directly into shared arrays; eliminate per-choice intermediate arrays + spreads + final content spread; indexed for-loops","median_request":2210,"median_response":587}}
{"run":31,"commit":"dc10a3b","metric":2001,"metrics":{"response_translation_ns":580,"stream_translation_ns":121},"status":"keep","description":"Pre-allocated indexed loop in translateAnthropicToolsToOpenAI","timestamp":1776910887545,"segment":1,"confidence":3.4232209737827715,"iterationTokens":514,"asi":{"all_runs_request":[2252,2149,2192,2214,2008,2001,2160,2043,2232,2266],"best_request":2001,"hypothesis":"Indexed for-loop with pre-allocated array in translateAnthropicToolsToOpenAI (replacing .map())","median":2176}}
{"run":32,"commit":"80f0a7d","metric":1936,"metrics":{"response_translation_ns":560,"stream_translation_ns":128},"status":"keep","description":"Stream translation: cache usage refs, indexed for over tool_calls","timestamp":1776910942936,"segment":1,"confidence":3.599264705882353,"iterationTokens":4559,"asi":{"all_runs_request":[2299,1993,2411,2020,1994,2024,1996,2043,1936,1970],"all_runs_stream":[124,157,157,119,121,144,109,132,132,128],"best_request":1936,"hypothesis":"Stream translation: cache chunk.usage and prompt_tokens_details?.cached_tokens locally; indexed for-loop over delta.tool_calls","median_request":2008,"median_stream":130}}
{"run":33,"commit":"d5f2f5a","metric":1914,"metrics":{"response_translation_ns":560,"stream_translation_ns":128},"status":"keep","description":"translateModelName: zero-alloc beta scanning","timestamp":1776911050429,"segment":1,"confidence":3.147798742138365,"iterationTokens":866,"asi":{"all_runs_request_run1":[2181,2253,2133,2008,1950,2033,2134,1994,1965,2115],"all_runs_request_run2":[1914,2096,2240,2659,2247,1944,1983,1999,1955,1937],"best_request":1914,"hypothesis":"translateModelName: avoid betas array allocation on null path; use charCode-based segment scanner instead of split().map().some()","median_run2":1991}}
{"run":34,"commit":"tool-re","metric":1921,"metrics":{"response_translation_ns":560,"stream_translation_ns":128},"status":"discard","description":"Inline string fast path for tool_result content","timestamp":1776911093591,"segment":1,"confidence":3.393220338983051,"iterationTokens":508,"asi":{"all_runs_request_run1_with_outliers":[4132,2717,2333,2101,2218,2206,2299,4040,4416],"all_runs_request_run2":[2516,2082,1993,1956,2010,1993,1975,1951,1921,1938],"best_request":1921,"hypothesis":"Inline string fast path for tool_result content (skip mapContent function call)","median_run2":1984,"rollback_reason":"Marginal at best; first run had heavy variance suggesting unstable system. Best/median ~same as prior."}}
{"run":35,"commit":"lazy-ar","metric":1921,"metrics":{"response_translation_ns":560,"stream_translation_ns":128},"status":"discard","description":"Lazy alloc per-type arrays in appendAssistantMessage","timestamp":1776911181987,"segment":1,"confidence":3.0847457627118646,"iterationTokens":518,"asi":{"all_runs_request_run1":[2193,2430,2408,2412,2492,2588,2541,2292,2316],"all_runs_request_run2":[4870,2084,2014,2074,1955,1921,1996,2000,2104,1984],"best_request":1921,"hypothesis":"Lazy alloc per-type arrays (textParts/thinkingParts/toolUseBlocks) in appendAssistantMessage","median_run2":1996,"rollback_reason":"No measurable improvement; lazy allocation adds null checks that offset the savings"}}
