{"run":36,"commit":"9b1d35a","metric":1744,"metrics":{"response_translation_ns":510,"stream_translation_ns":111},"status":"checks_failed","description":"Drop filteredContent in appendAssistantMessage; use allTextContent directly","timestamp":1776911486048,"segment":1,"confidence":2.827683615819209,"iterationTokens":2129,"asi":{"all_runs":[1846,1850,1910,1757,2050,1800,1744,1956,1981],"best_request":1744,"hypothesis":"Skip filteredContent allocation + mapContent call in assistant fallback - assistant blocks never contain images so mapContent only joins text+thinking which we already compute","median":1850,"next_action_hint":"Find optimization that doesn't remove tested code paths, or extend tests to cover server_tool_use-only assistant message","rollback_reason":"Coverage regression: protocols/ 99.37% -> 99.17% (-0.20pp). Tests pass but coverage gate is strict regression-based."}}
{"run":37,"commit":"9b1d35a","metric":1839,"metrics":{"response_translation_ns":510,"stream_translation_ns":111},"status":"checks_failed","description":"Use allTextContent in assistant fallback (keep filteredContent push)","timestamp":1776911607009,"segment":1,"confidence":2.8972503617945007,"iterationTokens":9700,"asi":{"all_runs":[1839,1952,1856,1962,2001,1908,1990,2369,6347],"best_request":1839,"hypothesis":"Keep filteredContent push (preserve coverage line) but use allTextContent in fallback branch instead of mapContent(filteredContent)","median":1962,"rollback_reason":"Same coverage regression: protocols/ 99.37 -> 99.19 (-0.18pp). Removing the mapContent fallback call (1 line) seems to lose multiline coverage somewhere. Untested fallback was the only assistant->mapContent caller."}}
{"run":38,"commit":"1e48e24","metric":1792,"metrics":{"response_translation_ns":510,"stream_translation_ns":111},"status":"keep","description":"Inline mapContent for string content in append* fast paths","timestamp":1776911673084,"segment":1,"confidence":3.3323442136498516,"iterationTokens":13662,"asi":{"all_runs":[1901,2039,1792,1932,1884,1858,2015,1895,1817],"best_request":1792,"hypothesis":"Inline mapContent for non-array (string) content in appendUserMessage and appendAssistantMessage to avoid function call overhead","median":1895}}
{"run":39,"commit":"1e48e24","metric":1809,"metrics":{"response_translation_ns":510,"stream_translation_ns":111},"status":"checks_failed","description":"Build translateToOpenAI result as single literal (stable hidden class)","timestamp":1776911750656,"segment":1,"confidence":3.3422619047619047,"iterationTokens":8879,"asi":{"all_runs":[2066,1892,1904,1989,1821,1832,1809,1907,2142],"best_request":1809,"hypothesis":"Build translateToOpenAI result as one stable literal (avoid hidden class transitions); inline tool_choice + reasoning_effort","median":1904,"next_action_hint":"Don't make translateAnthropicToolChoiceToOpenAI dead code; keep using it but skip the result.tool_choice = ... assignment by passing into literal","rollback_reason":"Coverage protocols/ 96.08% < 98.00% floor (-3.29pp). translateAnthropicToolChoiceToOpenAI helper became dead code. Also no perf gain (best 1809 vs prior 1792)."}}
{"run":40,"commit":"1e48e24","metric":1816,"metrics":{"response_translation_ns":510,"stream_translation_ns":111},"status":"checks_failed","description":"Single-literal result keeping helper calls inline","timestamp":1776911794591,"segment":1,"confidence":3.509375,"iterationTokens":5999,"asi":{"all_runs":[1837,1898,1816,1905,1863,2019,1861,1831,2422],"best_request":1816,"hypothesis":"Single-literal result with helper calls in initializer (avoid hidden class transitions)","median":1863,"next_action_hint":"Either widen interface to T | undefined or cast as ChatCompletionsPayload; perf was no better anyway","rollback_reason":"Typecheck error: exactOptionalPropertyTypes rejects 'T | undefined' for fields typed 'T | null'. Tests + coverage actually pass."}}
{"run":41,"commit":"1e48e24","metric":1815,"metrics":{"response_translation_ns":510,"stream_translation_ns":111},"status":"discard","description":"Inline stripBlockMetadata in append* hot loops","timestamp":1776911858332,"segment":1,"confidence":3.3323442136498516,"iterationTokens":9648,"asi":{"all_runs":[2087,1815,1933,2160,2014,2015,1871,1955,2078],"best_request":1815,"hypothesis":"Inline stripBlockMetadata in append* hot loops to avoid function call overhead","median":2014,"next_action_hint":"Function call already cheap; JIT inlines it. Look elsewhere.","rollback_reason":"No improvement (best 1815 vs prior 1792)"}}
{"run":42,"commit":"ef22403","metric":1775,"metrics":{"response_translation_ns":510,"stream_translation_ns":111},"status":"keep","description":"mapContent: skip join() for single-text-block case","timestamp":1776911885448,"segment":1,"confidence":3.619047619047619,"iterationTokens":1829,"asi":{"all_runs":[1876,1829,1822,1844,1973,1775,1789,1983,1799],"best_request":1775,"hypothesis":"mapContent: skip join() when textParts.length === 1 (return single string directly)","median":1829}}
{"run":43,"commit":"1d8c8bb","metric":1722,"metrics":{"response_translation_ns":510,"stream_translation_ns":111},"status":"keep","description":"Skip join() for single text/thinking part in assistant message","timestamp":1776911908136,"segment":1,"confidence":3.769352290679305,"iterationTokens":1766,"asi":{"all_runs":[2378,1823,1796,1722,1791,1802,1839,1934,1981],"best_request":1722,"hypothesis":"Skip join() for single text/thinking part in appendAssistantMessage allTextContent computation","median":1823}}
{"run":44,"commit":"1d8c8bb","metric":1779,"metrics":{"response_translation_ns":510,"stream_translation_ns":111},"status":"checks_failed","description":"Direct + concat for 1-text + 1-thinking common case","timestamp":1776911935983,"segment":1,"confidence":3.751572327044025,"iterationTokens":1991,"asi":{"all_runs":[1878,1998,2027,1822,1898,2044,1779,1920,2450],"best_request":1779,"hypothesis":"Direct concat for 1-text + 1-thinking case (avoid concat+join allocation)","median":1920,"rollback_reason":"Coverage regression protocols/ -0.18pp (concat fallback became less covered); also no perf improvement (1779 vs 1722)"}}
{"run":45,"commit":"1d8c8bb","metric":1728,"metrics":{"response_translation_ns":510,"stream_translation_ns":111},"status":"discard","description":"Reuse DEFAULT_FLAGS for common no-options case","timestamp":1776911979253,"segment":1,"confidence":3.9050736497545007,"iterationTokens":6137,"asi":{"all_runs":[1771,1761,1728,1857,1816,1999,1884,1978,2407],"best_request":1728,"hypothesis":"Reuse DEFAULT_FLAGS singleton when no sanitize/reorder options (skip flags object allocation)","median":1857,"rollback_reason":"No measurable improvement (1728 vs 1722); flags object alloc not significant"}}
{"run":46,"commit":"1d8c8bb","metric":1819,"metrics":{"response_translation_ns":510,"stream_translation_ns":111},"status":"discard","description":"Inline string fast path for tool_result content","timestamp":1776912001560,"segment":1,"confidence":4.071672354948806,"iterationTokens":1802,"asi":{"all_runs":[1873,1889,1874,1931,1819,1851,2004,1936,2012],"best_request":1819,"hypothesis":"Inline string fast path for tool_result content in appendUserMessage fast path","median":1889,"rollback_reason":"Worse perf (1819 vs 1722). Adding the type check + extra var assignment offset the saved function call."}}
{"run":47,"commit":"1d8c8bb","metric":1794,"metrics":{"response_translation_ns":510,"stream_translation_ns":111},"status":"discard","description":"Cache toolUseBlocks.length + toolUse.id locals","timestamp":1776912045791,"segment":1,"confidence":4.633009708737864,"iterationTokens":3629,"asi":{"all_runs":[2426,1794,1827,1956,1799,1827,2075,1841,1904],"best_request":1794,"hypothesis":"Cache toolUseBlocks.length and toolUse.id in locals","median":1841,"rollback_reason":"Worse perf (1794 vs 1722); JIT already does this CSE"}}
{"run":48,"commit":"2de27e6","metric":1858,"metrics":{"response_translation_ns":482,"stream_translation_ns":111},"status":"keep","description":"Cache usage lookup chain in translateToAnthropic","timestamp":1776912122903,"segment":1,"confidence":5.278761061946903,"iterationTokens":710,"asi":{"all_response":[524,684,538,482,552],"best_request":1858,"best_response":482,"hypothesis":"Cache rawCached / promptTokens locals in translateToAnthropic to avoid duplicate optional-chain lookups"}}
{"run":49,"commit":"2de27e6","metric":1746,"metrics":{"response_translation_ns":482,"stream_translation_ns":111},"status":"discard","description":"Cache anthropicMessages.length in local var","timestamp":1776912172184,"segment":1,"confidence":5.735576923076923,"iterationTokens":1789,"asi":{"all_runs":[1807,1841,1770,1831,1772,1780,1760,1746,2136],"best_request":1746,"hypothesis":"Cache anthropicMessages.length in local var for outer loop","median":1780,"rollback_reason":"Within noise (1746 vs 1722); JIT already hoists this"}}
{"run":50,"commit":"7e18e1e","metric":1750,"metrics":{"response_translation_ns":482,"stream_translation_ns":111},"status":"keep","description":"Normalize Message property order for hidden class sharing","timestamp":1776912227127,"segment":1,"confidence":6.2460732984293195,"iterationTokens":2089,"asi":{"all_runs":[1757,1766,1750,1777,1828,1778,1861,1774,1758],"best_request":1750,"hypothesis":"Normalize property order across all Message literals (role,content,name,tool_calls,tool_call_id) so all 4 message types share one hidden class","median":1774,"observation":"Variance significantly reduced (1750-1861, median 1774 vs prior 1750-2426)"}}
{"run":51,"commit":"7e18e1e","metric":1854,"metrics":{"response_translation_ns":482,"stream_translation_ns":111},"status":"discard","description":"Skip ids array allocation when trackIds flag false","timestamp":1776912477290,"segment":1,"confidence":6.501362397820164,"iterationTokens":8296,"asi":{"all_runs":[1913,2091,1909,1996,3256,1854,2009,1904,1878],"best_request":1854,"hypothesis":"Skip ids array allocation in appendAssistantMessage when sanitize/reorder flags are inactive (bench case)","median":1909,"rollback_reason":"Branch overhead from trackIds checks inside hot loop offsets the saved alloc; perf got worse"}}
{"run":52,"commit":"d35f01a","metric":1738,"metrics":{"response_translation_ns":482,"stream_translation_ns":111},"status":"keep","description":"Single object literal in translateToOpenAI (stable hidden class)","timestamp":1776912535775,"segment":1,"confidence":6.740112994350283,"iterationTokens":542,"asi":{"all_runs":[1770,1759,1764,1831,2020,1823,1802,1738,1761],"best_request":1738,"hypothesis":"Build translateToOpenAI result as single object literal with all optional fields included (undefined when absent). Skips hidden-class transitions. Uses 'as' cast to satisfy exactOptionalPropertyTypes.","median":1770,"observation":"Tighter variance and slightly better best/median than prior conditional-assignment version"}}
{"run":53,"commit":"d35f01a","metric":1787,"metrics":{"response_translation_ns":482,"stream_translation_ns":111},"status":"discard","description":"Reuse DEFAULT_FLAGS singleton (frozen)","timestamp":1776912569629,"segment":1,"confidence":6.778409090909091,"iterationTokens":2285,"asi":{"all_runs":[1818,1819,1798,1795,1795,1820,1824,1787,1787],"best_request":1787,"hypothesis":"Reuse DEFAULT_FLAGS singleton (Object.freeze) when no sanitize/reorder options","median":1798,"rollback_reason":"Worse perf (1787 vs 1738 baseline). Object.freeze may have cost or extra branch overhead."}}
{"run":54,"commit":"d35f01a","metric":1791,"metrics":{"response_translation_ns":482,"stream_translation_ns":111},"status":"checks_failed","description":"Hoist flagsActive to outer loop; pass through to appendUserMessage","timestamp":1776912646718,"segment":1,"confidence":6.817142857142857,"iterationTokens":6552,"asi":{"all_runs":[1823,1903,1897,1932,1887,1824,1951,1791,1980],"best_request":1791,"hypothesis":"Hoist flagsActive computation to translateAnthropicMessagesToOpenAI; pass to appendUserMessage","median":1897,"rollback_reason":"Worse perf (1791 vs 1738) + 1 flaky test timeout in checks (createApp /v1/* allows access). Discard.","test_failure":"createApp > /v1/* allows access with correct apiKey timed out after 5000ms - likely flaky"}}
{"run":55,"commit":"d35f01a","metric":1803,"metrics":{"response_translation_ns":482,"stream_translation_ns":111},"status":"discard","description":"Fast path mapContent for single text/thinking block","timestamp":1776912677456,"segment":1,"confidence":7.038348082595871,"iterationTokens":5997,"asi":{"all_runs":[1874,2050,1818,1931,2786,1903,1972,2765,1803],"best_request":1803,"hypothesis":"Fast path mapContent for len===1 text/thinking block (skip textParts allocation)","median":1931,"rollback_reason":"Worse perf (1803 vs 1738) and more variance. The extra type check + branch hurts more than it helps. Bench may not have many 1-block arrays."}}
{"run":56,"commit":"d35f01a","metric":1750,"metrics":{"response_translation_ns":482,"stream_translation_ns":111},"status":"discard","description":"Use prototype-less object lookup instead of Set.has for UNSUPPORTED_CONTENT_TYPES","timestamp":1776912777074,"segment":1,"confidence":7.101190476190476,"iterationTokens":506,"asi":{"all_runs_batch1":[1864,1771,1761,1851,1832,2005,2029,1753,1801],"all_runs_batch2":[1827,1860,1943,1813,1750,1802,1778,1828,2000],"best_request":1750,"hypothesis":"Replace Set.has lookup with prototype-less object property check (UNSUPPORTED_LOOKUP)","median_batch1":1832,"median_batch2":1813,"rollback_reason":"Within noise (best 1750 vs 1738 baseline). Bun's Set.has is already well-optimized for small sets."}}
{"run":57,"commit":"d35f01a","metric":0,"metrics":{"response_translation_ns":482,"stream_translation_ns":111},"status":"crash","description":"Pre-allocate contentParts in mapContent slow path","timestamp":1776912896389,"segment":1,"confidence":7.101190476190476,"iterationTokens":7823,"asi":{"hypothesis":"Pre-allocate contentParts array in mapContent slow path","rollback_reason":"ReferenceError: len is not defined - I incorrectly reused a variable from a previously-discarded edit","next_action_hint":"If retrying, define `const len = content.length` first"}}
{"run":58,"commit":"d773f32","metric":1694,"metrics":{"response_translation_ns":482,"stream_translation_ns":111},"status":"keep","description":"Drop filteredContent in appendAssistantMessage; reuse mapContent's switch filtering in fallback","timestamp":1776912995918,"segment":1,"confidence":8.659574468085106,"iterationTokens":520,"asi":{"all_runs_batch1":[1719,1732,1766,1736,1783,1740,1705,1694,1960],"all_runs_batch2":[1737,1904,1762,1772,1750,1810,1721,1721,2182],"best_request":1694,"hypothesis":"Drop filteredContent allocation entirely; use mapContent(content) in fallback (mapContent already ignores unsupported types via switch fall-through)","median_batch1":1736,"median_batch2":1762,"observation":"Significant improvement from baseline ~1738 to ~1720. Checks pass (mapContent line still covered, just no filteredContent.push)."}}
{"run":59,"commit":"d773f32","metric":1947,"metrics":{"response_translation_ns":482,"stream_translation_ns":111},"status":"checks_failed","description":"Use allTextContent directly in assistant fallback (skip mapContent)","timestamp":1776913036644,"segment":1,"confidence":7.267857142857143,"iterationTokens":2803,"asi":{"all_runs":[1947,2468,2152,2026,1965,2023,2190,1958,1960],"best_request":1947,"hypothesis":"Use allTextContent directly in fallback (skip mapContent call)","median":2023,"rollback_reason":"Coverage protocols/ 99.37 -> 99.08 (-0.29pp). Removing mapContent call leaves some mapContent branches uncovered. Also perf surprisingly worse this run."}}
{"run":60,"commit":"d773f32","metric":1768,"metrics":{"response_translation_ns":482,"stream_translation_ns":111},"status":"discard","description":"translateModelName: try NO_MINOR regex first","timestamp":1776914791944,"segment":1,"confidence":8.847826086956522,"iterationTokens":585,"asi":{"all_runs":[1797,1896,1817,1975,1932,2029,1768,1811,1793],"best":1768,"hypothesis":"Bench fixture model 'claude-sonnet-4-20250514' matches NO_MINOR; trying it first saves one regex call.","median":1817,"rollback_reason":"Worse than baseline 1694 best / 1736 median."}}
{"run":61,"commit":"d773f32","metric":1761,"metrics":{"response_translation_ns":482,"stream_translation_ns":111},"status":"discard","description":"Build tool_calls inline during scan (skip intermediate toolUseBlocks array)","timestamp":1776914890665,"segment":1,"confidence":10.901785714285714,"iterationTokens":10290,"asi":{"all_runs":[2039,1844,1916,1837,1825,1889,1789,1762,1761],"best":1761,"hypothesis":"Build tool_calls + ids inline during scan to avoid intermediate toolUseBlocks array + second loop","median":1837,"rollback_reason":"Worse than baseline 1694/1736. Lazy alloc + push (.length check) costs more than known-size new Array() + indexed write"}}
{"run":62,"commit":"d773f32","metric":1716,"metrics":{"response_translation_ns":482,"stream_translation_ns":111},"status":"discard","description":"mapContent: single-pass on-demand contentParts (skip 2nd image iteration)","timestamp":1776914944922,"segment":1,"confidence":11,"iterationTokens":5074,"asi":{"all_runs":[1995,1827,1728,1766,1889,1825,1716,1745,1909],"best":1716,"hypothesis":"mapContent: build contentParts on-demand single-pass to skip 2nd full iteration when image present","median":1825,"rollback_reason":"Worse than baseline 1694/1736 best/median. Lazy null check overhead on every block + branchy dual-array logic outweighs saved iteration"}}
{"run":63,"commit":"d773f32","metric":1737,"metrics":{"response_translation_ns":482,"stream_translation_ns":111},"status":"discard","description":"stripBlockMetadata: undefined-compare instead of `in`","timestamp":1776915022983,"segment":1,"confidence":11.1,"iterationTokens":3967,"asi":{"all_runs":[1805,1737,1903,1873,1961,2142,1834,1766,1986,1805],"best":1737,"hypothesis":"Replace `in` with undefined comparison in stripBlockMetadata to skip prototype walk","median":1873,"rollback_reason":"Worse than baseline. Property access requires hidden-class lookup, while `in` uses fast path; opposite of expectation"}}
{"run":64,"commit":"d773f32","metric":1738,"metrics":{"response_translation_ns":482,"stream_translation_ns":111},"status":"checks_failed","description":"Switch-first dispatch in appendAssistantMessage","timestamp":1776915103842,"segment":1,"confidence":11.57345971563981,"iterationTokens":6193,"asi":{"all_runs":[1738,2027,1876,1839,1786,1804,1768,1909,1802,1738],"best":1738,"hypothesis":"Switch first to dispatch known types fast, default branch handles UNSUPPORTED","median":1804,"rollback_reason":"Coverage protocols/ 99.37 -> 99.09 (-0.28pp). New default branch is not exercised by any tests (no assistant tests with unknown-but-not-unsupported block types)."}}
{"run":65,"commit":"d773f32","metric":1747,"metrics":{"response_translation_ns":482,"stream_translation_ns":111},"status":"checks_failed","description":"Short-circuit type compare before Set.has","timestamp":1776915143563,"segment":1,"confidence":12.089108910891088,"iterationTokens":6590,"asi":{"all_runs":[1788,1758,1747,1806,1756,1996,2045,1835,1805,1788],"best":1747,"hypothesis":"Short-circuit string compare to skip Set.has for known types","median":1805,"rollback_reason":"Coverage protocols/ 99.37 -> 99.19 (-0.18pp). Short-circuit conditions reduce branch coverage somewhere."}}
{"run":66,"commit":"d773f32","metric":1789,"metrics":{"response_translation_ns":482,"stream_translation_ns":111},"status":"discard","description":"Use EMPTY_IDS as initial pendingToolCallIds","timestamp":1776915206961,"segment":1,"confidence":13.271739130434783,"iterationTokens":8912,"asi":{"all_runs":[1820,2100,1892,1978,1823,1829,1789,1985,1969,1820],"best":1789,"hypothesis":"Use EMPTY_IDS as initial pendingToolCallIds (skip empty array alloc per call)","median":1892,"rollback_reason":"Worse than baseline. Saved alloc was negligible; runtime variance dominant"}}
{"run":67,"commit":"582485a","metric":1561,"metrics":{"response_translation_ns":482,"stream_translation_ns":111},"status":"keep","description":"Cache translateModelName results in a Map","timestamp":1776915327392,"segment":1,"confidence":14.25263157894737,"iterationTokens":4788,"asi":{"all_runs":[1561,1603,1599,2661,1630,1645,1788,1596,1613,1561],"best":1561,"hypothesis":"Cache translateModelName results in a Map (model+beta -> translated name); same (model,beta) recurs across repeat clients. Cleared at 64 entries.","median":1613,"improvement_pct":"~9% from prior best 1706"}}
{"run":68,"commit":"582485a","metric":1599,"metrics":{"response_translation_ns":482,"stream_translation_ns":111},"status":"discard","description":"WeakMap cache for translateAnthropicToolsToOpenAI","timestamp":1776915368348,"segment":1,"confidence":14.104166666666666,"iterationTokens":2695,"asi":{"all_runs":[1727,1599,1671,1607,1620,1679,1662,1622,1607,1727],"best":1599,"hypothesis":"WeakMap-cache translateAnthropicToolsToOpenAI on input array reference","median":1641,"rollback_reason":"Slightly worse than caching-baseline 1561/1613. tools translation is already fast; WeakMap overhead ~= saved work."}}
{"run":69,"commit":"582485a","metric":1626,"metrics":{"response_translation_ns":482,"stream_translation_ns":111},"status":"checks_failed","description":"Inline appendSystemPrompt into translateAnthropicMessagesToOpenAI","timestamp":1776915406623,"segment":1,"confidence":13.816326530612244,"iterationTokens":2923,"asi":{"all_runs":[1712,1807,1647,1678,1723,1626,1818,1663,1653,1712],"best":1626,"hypothesis":"Inline appendSystemPrompt","median":1695,"rollback_reason":"Coverage -0.96pp: appendSystemPrompt becomes dead code. Also perf worse than baseline."}}
